{
  "id": "cq-ww-ssb-2026",
  "templateId": "cq_ww",
  "name": "CQ World Wide DX Contest SSB 2026",
  "year": 2026,
  "start_at": "2026-10-24T00:00:00Z",
  "end_at": "2026-10-25T23:59:00Z",
  "description": "Last full weekend entirely within October. CQ WW runs SSB and CW as separate weekends using the same exchange/template.",
  "source_url": "https://cqww.com/index.htm"
}
